{
  "artifact_id": "8e2132876d99d509cc2070158a8e98cef5f775e4c0d08a15305139c4426514ab",
  "calendar": "XNYS",
  "contract_id": "iteration-16-market-source-v1",
  "corporate_action_adjusted": true,
  "data_file_path": "snapshots/2026-07-14T072243Z-14347417-1/market_prices.csv",
  "data_file_sha256": "a2d9275d08d89a325959bf464083de2809f332ad059c5db29185733d3f5c7f2c",
  "data_format": "csv",
  "encoding": "utf-8",
  "end_date": "2026-07-13",
  "manifest_version": "1.0.0",
  "notes": "Validated public Iteration 16 market-data publication.",
  "provider_name": "Yahoo Finance chart API",
  "regular_session_only": true,
  "row_count": 330,
  "source_commit_sha": "06c4a28e5579b45351f3d331aa15580a25d89838",
  "source_data_modified": false,
  "source_repository": "poudlesuman32-star/ai-market-news",
  "start_date": "2026-05-29",
  "symbol_count": 11,
  "symbols": [
    "BE",
    "CAR",
    "GEV",
    "INTC",
    "MU",
    "NVDA",
    "PLTR",
    "POWL",
    "SNDK",
    "SPY",
    "VRT"
  ],
  "synthetic_prices_used": false,
  "timezone": "America/New_York"
}
