{
  "artifact_id": "56cb0ad9c371dde3bd2ad3b47459d923bd956f7138ca7ce9e5041ffffc3c4490",
  "calendar": "XNYS",
  "contract_id": "iteration-16-market-source-v1",
  "corporate_action_adjusted": true,
  "data_file_path": "snapshots/2026-07-05T234500Z-test/market_prices.csv",
  "data_file_sha256": "780ba22c3c1e9bd5bd55e0e8aa030ccfd2c03a447cf5be3b04b8b76e9d041434",
  "data_format": "csv",
  "encoding": "utf-8",
  "end_date": "2026-05-29",
  "manifest_version": "1.0.0",
  "notes": "Deterministic contract fixture.",
  "provider_name": "Fixture Provider",
  "regular_session_only": true,
  "row_count": 11,
  "source_commit_sha": "aaaaaaaaaaaaaaaaaaaaaaaaaaaaaaaaaaaaaaaa",
  "source_data_modified": false,
  "source_repository": "poudlesuman32-star/ai-market-news",
  "start_date": "2026-05-29",
  "symbol_count": 11,
  "symbols": [
    "BE",
    "CAR",
    "GEV",
    "INTC",
    "MU",
    "NVDA",
    "PLTR",
    "POWL",
    "SNDK",
    "SPY",
    "VRT"
  ],
  "synthetic_prices_used": false,
  "timezone": "America/New_York"
}
